name,Price,manufacturer,Socket,Memory Type,Memory Slots,Form Factor,Memory Max,Chipset,Has Wifi,Color,SATA Ports,M.2 Slots
MSI B650 GAMING PLUS WIFI,$129.99 ,MSI,AM5,DDR5,4,ATX,192 GB,AMD B650,TRUE,Black,4,2
MSI MAG B850 TOMAHAWK MAX WIFI,$229.99 ,MSI,AM5,DDR5,4,ATX,256 GB,AMD B850,TRUE,Black / Green,4,5
Gigabyte B850 AORUS ELITE WIFI7,$224.57 ,Gigabyte,AM5,DDR5,4,ATX,256 GB,AMD B850,TRUE,Black,4,3
Asus B650E MAX GAMING WIFI W,$139.99 ,Asus,AM5,DDR5,4,ATX,256 GB,AMD B650E,TRUE,White,4,3
Asus PRIME B550M-A WIFI II,$84.99 ,Asus,AM4,DDR4,4,Micro ATX,128 GB,AMD B550,TRUE,Blue / Silver,4,2
Asus TUF GAMING B850-PLUS WIFI,$218.00 ,Asus,AM5,DDR5,4,ATX,256 GB,AMD B850,TRUE,Black / Silver,4,3
Gigabyte B650 EAGLE AX,$156.00 ,Gigabyte,AM5,DDR5,4,ATX,192 GB,AMD B650,TRUE,Gray / Black,4,3
Gigabyte B650M GAMING PLUS WIFI,$104.99+,Gigabyte,AM5,DDR5,4,Micro ATX,192 GB,AMD B650,TRUE,Silver / Black,4,2
ASRock B850M Pro-A WiFi,$141.98 ,ASRock,AM5,DDR5,4,Micro ATX,256 GB,AMD B850,TRUE,Black,4,4
Gigabyte X870E AORUS ELITE WIFI7,$299.00 ,Gigabyte,AM5,DDR5,4,ATX,256 GB,AMD X870E,TRUE,Black,4,4
MSI B550M PRO-VDH WIFI,$84.99 ,MSI,AM4,DDR4,4,Micro ATX,128 GB,AMD B550,TRUE,Black,4,2
MSI MAG B650 TOMAHAWK WIFI,$219.00 ,MSI,AM5,DDR5,4,ATX,256 GB,AMD B650,TRUE,Black,6,3
MSI MAG X870 TOMAHAWK WIFI,$259.99 ,MSI,AM5,DDR5,4,ATX,256 GB,AMD X870,TRUE,Black,4,4
Gigabyte B550M GAMING X WIFI6,$104.99 ,Gigabyte,AM4,DDR4,4,Micro ATX,128 GB,AMD B550,TRUE,Gray / Black,4,2
ASRock B650M Pro RS WiFi,$109.99 ,ASRock,AM5,DDR5,4,Micro ATX,256 GB,AMD B650,TRUE,Black / Silver,4,4
Gigabyte A520M K V2,$74.00 ,Gigabyte,AM4,DDR4,2,Micro ATX,64 GB,AMD A520,FALSE,Brown / Black,4,1
ASRock B850I Lightning WiFi,$169.99 ,ASRock,AM5,DDR5,2,Mini ITX,128 GB,AMD B850,TRUE,Black,2,3
Asus TUF GAMING B650E-E WIFI,$191.99+,Asus,AM5,DDR5,4,ATX,256 GB,AMD B650,TRUE,Black,4,3
Gigabyte B550 EAGLE WIFI6,$99.99 ,Gigabyte,AM4,DDR4,4,ATX,128 GB,AMD B550,TRUE,Black,4,2
MSI PRO Z790-A MAX WIFI,$259.99 ,MSI,LGA1700,DDR5,4,ATX,256 GB,Intel Z790,TRUE,Silver / Black,6,5
Gigabyte B850 GAMING WIFI6,$179.99 ,Gigabyte,AM5,DDR5,4,ATX,256 GB,AMD B850,TRUE,Black / Gray,4,3
Asus ROG STRIX B850-A GAMING WIFI,$189.99 ,Asus,AM5,DDR5,4,ATX,192 GB,AMD B850,TRUE,White,2,4
Asus Z790 GAMING WIFI7,$149.99 ,Asus,LGA1700,DDR5,4,ATX,192 GB,Intel Z790,TRUE,Silver / Black,4,3
Gigabyte B850 AORUS ELITE WIFI7 ICE,$239.99 ,Gigabyte,AM5,DDR5,4,ATX,256 GB,AMD B850,TRUE,White / Silver,4,3
Gigabyte B850 GAMING X WIFI6E,$159.99 ,Gigabyte,AM5,DDR5,4,ATX,256 GB,AMD B850,TRUE,Gray / Black,4,3
Gigabyte B550M K,$84.99 ,Gigabyte,AM4,DDR4,4,Micro ATX,128 GB,AMD B550,FALSE,Brown / Silver,4,2
MSI MAG B550 TOMAHAWK MAX WIFI,$154.44 ,MSI,AM4,DDR4,4,ATX,128 GB,AMD B550,TRUE,Silver / Black,6,3
ASRock B450M/ac R2.0,$79.99 ,ASRock,AM4,DDR4,4,Micro ATX,128 GB,AMD B450,TRUE,Black / Silver,4,2
Gigabyte B760M GAMING PLUS WIFI DDR4,$137.99 ,Gigabyte,LGA1700,DDR4,4,Micro ATX,128 GB,Intel B760,TRUE,Black / Silver,4,2
MSI PRO B650-S WIFI,$139.99 ,MSI,AM5,DDR5,4,ATX,192 GB,AMD B650,TRUE,Black,4,3
Asus ROG STRIX X870E-E GAMING WIFI,$369.99 ,Asus,AM5,DDR5,4,ATX,256 GB,AMD X870E,TRUE,Black,4,5
Asus ROG CROSSHAIR X870E EXTREME,$920.99 ,Asus,AM5,DDR5,4,EATX,256 GB,AMD X870E,TRUE,Black / Silver,4,5
Asus PRIME B650-PLUS WIFI,$228.65 ,Asus,AM5,DDR5,4,ATX,192 GB,AMD B650,TRUE,Black / Silver,4,2
Asus ROG STRIX B550-F GAMING WIFI II,$129.99 ,Asus,AM4,DDR4,4,ATX,128 GB,AMD B550,TRUE,Black / Red,6,2
ASRock B650M Pro RS,$99.99 ,ASRock,AM5,DDR5,4,Micro ATX,256 GB,AMD B650,FALSE,Black / Silver,4,4
Gigabyte X870 AORUS ELITE WIFI7 ICE,$259.99 ,Gigabyte,AM5,DDR5,4,ATX,256 GB,AMD X870,TRUE,White,4,4
Asus ROG STRIX B850-F GAMING WIFI,$281.99 ,Asus,AM5,DDR5,4,ATX,192 GB,AMD B850,TRUE,Black,2,4
ASRock B550M-ITX/ac,$84.99 ,ASRock,AM4,DDR4,2,Mini ITX,64 GB,AMD B550,TRUE,Silver / Black,4,2
ASRock B850M-X WiFi R2.0,$129.99 ,ASRock,AM5,DDR5,2,Micro ATX,128 GB,AMD B850,TRUE,Black / White,4,3
Asus ROG STRIX X870-A GAMING WIFI,$248.00 ,Asus,AM5,DDR5,4,ATX,256 GB,AMD X870,TRUE,White,2,4
MSI Z890 GAMING PLUS WIFI,$189.99 ,MSI,LGA1851,DDR5,4,ATX,256 GB,Intel Z890,TRUE,Black,4,4
MSI B850 GAMING PLUS WIFI,$169.99 ,MSI,AM5,DDR5,4,ATX,256 GB,AMD B850,TRUE,Silver / Black,4,3
Gigabyte B650 GAMING X AX V2,$189.98 ,Gigabyte,AM5,DDR5,4,ATX,192 GB,AMD B650,TRUE,Gray / Black,4,3
ASRock B650I Lightning Wifi,$159.99 ,ASRock,AM5,DDR5,2,Mini ITX,96 GB,AMD B650,TRUE,Black,2,3
Asus TUF GAMING B850M-PLUS WIFI,$199.99 ,Asus,AM5,DDR5,4,Micro ATX,256 GB,AMD B850,TRUE,Black,4,3
Gigabyte B650 AORUS ELITE AX V2,$159.99 ,Gigabyte,AM5,DDR5,4,ATX,192 GB,AMD B650,TRUE,Black / Silver,4,3
MSI MPG B550 GAMING PLUS,$89.99 ,MSI,AM4,DDR4,4,ATX,128 GB,AMD B550,FALSE,Black,6,2
Gigabyte B550M AORUS ELITE AX,$109.99 ,Gigabyte,AM4,DDR4,4,Micro ATX,128 GB,AMD B550,TRUE,Black / Silver,4,2
ASRock B760M PG Riptide Wifi,$119.99 ,ASRock,LGA1700,DDR5,4,Micro ATX,192 GB,Intel B760,TRUE,Black,4,3
Gigabyte B850 EAGLE WIFI6E,$174.99 ,Gigabyte,AM5,DDR5,4,ATX,256 GB,AMD B850,TRUE,Gray / Black,4,3
Asus TUF GAMING B550-PLUS WIFI II,$119.99 ,Asus,AM4,DDR4,4,ATX,128 GB,AMD B550,TRUE,Black / Gray,6,2
MSI MAG X870E TOMAHAWK WIFI,$249.99 ,MSI,AM5,DDR5,4,ATX,256 GB,AMD X870E,TRUE,Black / Green,4,5
MSI B550-A PRO,$79.99 ,MSI,AM4,DDR4,4,ATX,128 GB,AMD B550,FALSE,Black / Silver,6,2
MSI MPG X870E CARBON WIFI,$349.99 ,MSI,AM5,DDR5,4,ATX,256 GB,AMD X870E,TRUE,Black,4,4
Gigabyte Z790 EAGLE AX,$169.99 ,Gigabyte,LGA1700,DDR5,4,ATX,256 GB,Intel Z790,TRUE,Gray / Black,4,3
MSI PRO B650M-A WIFI,$129.99 ,MSI,AM5,DDR5,4,Micro ATX,192 GB,AMD B650,TRUE,Black,4,2
MSI B850 GAMING PLUS WIFI6E,$174.99 ,MSI,AM5,DDR5,4,ATX,256 GB,AMD B850,TRUE,Silver,4,2
ASRock B450M-HDV R4.0,$69.50+,ASRock,AM4,DDR4,2,Micro ATX,64 GB,AMD B450,FALSE,Black / White,4,1
Asus TUF GAMING B650-PLUS WIFI,$164.99 ,Asus,AM5,DDR5,4,ATX,128 GB,AMD B650,TRUE,Black,4,3
Asus TUF GAMING B650E-PLUS WIFI,$169.99 ,Asus,AM5,DDR5,4,ATX,256 GB,AMD B650E,TRUE,Black / Silver,4,3
Gigabyte X870 EAGLE WIFI7,$199.99 ,Gigabyte,AM5,DDR5,4,ATX,256 GB,AMD X870,TRUE,Black,4,3
Asus ROG STRIX B650E-I GAMING WIFI,$189.99 ,Asus,AM5,DDR5,2,Mini ITX,96 GB,AMD B650E,TRUE,Black,2,2
Asus ROG STRIX B850-I GAMING WIFI,$289.99 ,Asus,AM5,DDR5,2,Mini ITX,96 GB,AMD B850,TRUE,Black,2,2
ASRock A620AI WiFi,$130.99 ,ASRock,AM5,DDR5,2,Mini ITX,128 GB,AMD A620A,TRUE,Black,2,3
MSI PRO B550M-VC WIFI,$89.99 ,MSI,AM4,DDR4,4,Micro ATX,128 GB,AMD B550,TRUE,Black,8,3
MSI PRO B760-P WIFI DDR4,$139.99 ,MSI,LGA1700,DDR4,4,ATX,128 GB,Intel B760,TRUE,Black,4,2
MSI PRO X870E-P WIFI,$237.95+,MSI,AM5,DDR5,4,ATX,256 GB,AMD X870E,TRUE,Black / Silver,4,3
ASRock B650M-HDV/M.2 White,$94.99 ,ASRock,AM5,DDR5,2,Micro ATX,128 GB,AMD B650,FALSE,White,4,3
Asus ROG STRIX B650E-F GAMING WIFI,$209.95 ,Asus,AM5,DDR5,4,ATX,192 GB,AMD B650E,TRUE,Black,4,3
ASRock B550M Pro4,$74.99 ,ASRock,AM4,DDR4,4,Micro ATX,128 GB,AMD B550,FALSE,Silver / Black,6,3
ASRock B850M Pro RS WiFi,$129.99 ,ASRock,AM5,DDR5,4,Micro ATX,256 GB,AMD B850,TRUE,Silver / Black,4,4
MSI A520M-A PRO,$69.99 ,MSI,AM4,DDR4,2,Micro ATX,64 GB,AMD A520,FALSE,Black,4,1
Gigabyte X870 AORUS ELITE WIFI7,$269.39 ,Gigabyte,AM5,DDR5,4,ATX,256 GB,AMD X870,TRUE,Black,4,4
ASRock A620AM-X,$79.98 ,ASRock,AM5,DDR5,2,Micro ATX,128 GB,AMD A620A,FALSE,Black,4,2
Asus B760M-AYW WIFI D4 II,$89.99 ,Asus,LGA1700,DDR4,2,Micro ATX,64 GB,Intel B760,TRUE,Black / Silver,4,2
Gigabyte X870E AORUS PRO ICE,$299.99 ,Gigabyte,AM5,DDR5,4,ATX,256 GB,AMD X870E,TRUE,White,4,4
ASRock B650 Steel Legend WiFi,$159.99 ,ASRock,AM5,DDR5,4,ATX,256 GB,AMD B650,TRUE,White / Silver,4,4
Asus ROG STRIX B650-A GAMING WIFI,$169.99 ,Asus,AM5,DDR5,4,ATX,192 GB,AMD B650,TRUE,Black / Silver,4,3
Asus ROG CROSSHAIR X870E HERO,$669.99 ,Asus,AM5,DDR5,4,ATX,256 GB,AMD X870E,TRUE,Black,4,5
MSI B760 GAMING PLUS WIFI,$204.99 ,MSI,LGA1700,DDR5,4,ATX,192 GB,Intel B760,TRUE,Black / Silver,4,3
MSI PRO B850M-P WIFI,$179.99 ,MSI,AM5,DDR5,4,Micro ATX,256 GB,AMD B850,TRUE,Black / Silver,4,3
Asus TUF GAMING X870-PLUS WIFI,$229.99 ,Asus,AM5,DDR5,4,ATX,192 GB,AMD X870,TRUE,Black,2,4
Gigabyte B850M GAMING X WIFI6E,$164.99 ,Gigabyte,AM5,DDR5,4,Micro ATX,256 GB,AMD B850,TRUE,Black,4,2
Asus ROG STRIX X870-I GAMING WIFI,$449.99 ,Asus,AM5,DDR5,2,Mini ITX,128 GB,AMD X870,TRUE,Black,2,2
ASRock B650M-HDV/M.2,$109.99 ,ASRock,AM5,DDR5,2,Micro ATX,96 GB,AMD B650,FALSE,Silver / Black,4,3
Asus ROG ZENITH II EXTREME ALPHA,N/A,Asus,sTRX4,DDR4,8,EATX,256 GB,AMD TRX40,TRUE,Black / Silver,8,5
Asus ROG STRIX X870E-H GAMING WIFI7,$259.99 ,Asus,AM5,DDR5,4,ATX,256 GB,AMD X870E,TRUE,Black,4,4
Gigabyte B650 AORUS ELITE AX,$159.99 ,Gigabyte,AM5,DDR5,4,ATX,192 GB,AMD B650,TRUE,Black / Silver,4,3
MSI PRO H610M-G DDR4,$90.00 ,MSI,LGA1700,DDR4,2,Micro ATX,64 GB,Intel H610,FALSE,Black / Silver,4,2
Gigabyte B550 GAMING X V2,$109.99 ,Gigabyte,AM4,DDR4,4,ATX,128 GB,AMD B550,FALSE,Black,4,2
MSI B450M-A PRO MAX II,$128.63 ,MSI,AM4,DDR4,2,Micro ATX,64 GB,AMD B450,FALSE,Black,4,1
ASRock A620AM-X WiFi,$248.06+,ASRock,AM5,DDR5,2,Micro ATX,128 GB,AMD A620A,TRUE,Black,4,2
MSI PRO B850-S WIFI6E,$149.99 ,MSI,AM5,DDR5,4,ATX,256 GB,AMD B850,TRUE,Black,4,2
Gigabyte X870I AORUS PRO ICE,$284.99 ,Gigabyte,AM5,DDR5,2,Mini ITX,128 GB,AMD X870,TRUE,White,2,2
ASRock Phantom Gaming X870E Nova WiFi,$259.99 ,ASRock,AM5,DDR5,4,ATX,256 GB,AMD X870E,TRUE,Black / Purple,4,6
ASRock B650 PG LIGHTNING,$188.46+,ASRock,AM5,DDR5,4,ATX,256 GB,AMD B650,FALSE,Black,4,4
Gigabyte B850M AORUS ELITE WIFI6E ICE,$189.99 ,Gigabyte,AM5,DDR5,4,Micro ATX,256 GB,AMD B850,TRUE,White / Silver,4,2
Gigabyte Z790 AORUS ELITE AX,$199.99 ,Gigabyte,LGA1700,DDR5,4,ATX,256 GB,Intel Z790,TRUE,Black,6,4
ASRock A520M-HDV,$69.98 ,ASRock,AM4,DDR4,2,Micro ATX,64 GB,AMD A520,FALSE,Black / Silver,4,1
MSI MPG B850I EDGE TI WIFI,$259.99 ,MSI,AM5,DDR5,2,Mini ITX,128 GB,AMD B850,TRUE,Silver,2,2
Gigabyte B850M EAGLE WIFI6E,$149.99 ,Gigabyte,AM5,DDR5,4,Micro ATX,256 GB,AMD B850,TRUE,Black,4,2
ASRock B550 Phantom Gaming 4/ac,$74.98 ,ASRock,AM4,DDR4,4,ATX,128 GB,AMD B550,TRUE,Silver / Black,4,2
Gigabyte B850M EAGLE WIFI6E ICE,$149.99 ,Gigabyte,AM5,DDR5,4,Micro ATX,256 GB,AMD B850,TRUE,White,4,2
MSI MAG B550 TOMAHAWK,$155.99 ,MSI,AM4,DDR4,4,ATX,128 GB,AMD B550,FALSE,Black / Silver,6,2
MSI MAG B850M MORTAR WIFI,$209.99 ,MSI,AM5,DDR5,4,Micro ATX,256 GB,AMD B850,TRUE,Black / Green,4,5
MSI Z790 GAMING PLUS WIFI,$149.99 ,MSI,LGA1700,DDR5,4,ATX,256 GB,Intel Z790,TRUE,Black,6,4
Asus TUF GAMING Z790-PLUS WIFI,$198.99+,Asus,LGA1700,DDR5,4,ATX,192 GB,Intel Z790,TRUE,Black / Gray,4,4
MSI MEG X870E GODLIKE,$899.99 ,MSI,AM5,DDR5,4,EATX,256 GB,AMD X870E,TRUE,Black,4,5
Gigabyte A520I AC,$109.99 ,Gigabyte,AM4,DDR4,2,Mini ITX,64 GB,AMD A520,TRUE,Black,4,1
MSI B760M GAMING PLUS WIFI,$213.97 ,MSI,LGA1700,DDR5,4,Micro ATX,192 GB,Intel B760,TRUE,Black / Silver,4,2
Asus TUF GAMING X870E-PLUS WIFI7,$259.99 ,Asus,AM5,DDR5,4,ATX,256 GB,AMD X870E,TRUE,Black / Silver,4,4
Asus ProArt X870E-CREATOR WIFI,$484.00+,Asus,AM5,DDR5,4,ATX,256 GB,AMD X870E,TRUE,Black / Gold,4,4
Asus B650E MAX GAMING WIFI,N/A,Asus,AM5,DDR5,4,ATX,192 GB,AMD B650E,TRUE,Black / Silver,4,3
Asus TUF GAMING B760-PLUS WIFI,$168.00 ,Asus,LGA1700,DDR5,4,ATX,192 GB,Intel B760,TRUE,Black,4,3
Gigabyte B850 EAGLE WIFI7 ICE,$184.99 ,Gigabyte,AM5,DDR5,4,ATX,256 GB,AMD B850,TRUE,White,4,3
MSI MPG X870E EDGE TI WIFI,$269.99 ,MSI,AM5,DDR5,4,ATX,256 GB,AMD X870E,TRUE,Silver / White,4,5
Gigabyte B650 AORUS ELITE AX ICE,$215.99 ,Gigabyte,AM5,DDR5,4,ATX,192 GB,AMD B650,TRUE,Silver,4,3
MSI PRO B650M-P,$129.99 ,MSI,AM5,DDR5,4,Micro ATX,192 GB,AMD B650,FALSE,Black / Silver,4,2
MSI PRO B650-A WIFI,$139.99 ,MSI,AM5,DDR5,4,ATX,256 GB,AMD B650,TRUE,Black / Silver,6,3
Asus TUF GAMING B850-E WIFI,$179.99 ,Asus,AM5,DDR5,4,ATX,256 GB,AMD B850,TRUE,Black,4,3
Gigabyte TRX40 DESIGNARE,$999.00+,Gigabyte,sTRX4,DDR4,8,XL ATX,256 GB,AMD TRX40,TRUE,Black / Silver,8,4
Gigabyte A620I AX,$147.99 ,Gigabyte,AM5,DDR5,2,Mini ITX,96 GB,AMD A620,TRUE,Black / Gray,2,1
Gigabyte B650M GAMING WIFI6E,$177.67+,Gigabyte,AM5,DDR5,2,Micro ATX,128 GB,AMD B650,TRUE,Silver / Black,4,1
MSI B650M GAMING PLUS WIFI,N/A,MSI,AM5,DDR5,4,Micro ATX,192 GB,AMD B650,TRUE,Silver / Black,4,3
MSI PRO B850-P WIFI,$199.99 ,MSI,AM5,DDR5,4,ATX,256 GB,AMD B850,TRUE,Silver / Black,4,3
Gigabyte B550I AORUS PRO AX,$179.99 ,Gigabyte,AM4,DDR4,2,Mini ITX,64 GB,AMD B550,TRUE,Black / Silver,4,2
Asus TUF GAMING X570-PLUS (WI-FI),N/A,Asus,AM4,DDR4,4,ATX,128 GB,AMD X570,TRUE,Black / Gold,8,2
ASRock X870 Pro RS WiFi,$179.99 ,ASRock,AM5,DDR5,4,ATX,256 GB,AMD X870,TRUE,White,4,4
ASRock B850M Steel Legend WiFi,$139.99 ,ASRock,AM5,DDR5,4,Micro ATX,256 GB,AMD B850,TRUE,Silver / Black,4,4
MSI MPG B650I EDGE WIFI,$194.99 ,MSI,AM5,DDR5,2,Mini ITX,128 GB,AMD B650,TRUE,Black / Silver,4,2
MSI B450 TOMAHAWK MAX,N/A,MSI,AM4,DDR4,4,ATX,128 GB,AMD B450,FALSE,Black,6,1
Gigabyte B550 UD AC,$99.99 ,Gigabyte,AM4,DDR4,4,ATX,128 GB,AMD B550,TRUE,Brown / Black,4,2
MSI PRO B760M-P DDR4,$104.99 ,MSI,LGA1700,DDR4,4,Micro ATX,128 GB,Intel B760,FALSE,Black,4,2
ASRock B850M-X R2.0,$112.98 ,ASRock,AM5,DDR5,2,Micro ATX,128 GB,AMD B850,FALSE,Black / White,4,3
Gigabyte X870E AORUS MASTER X3D ICE,$649.99 ,Gigabyte,AM5,DDR5,4,ATX,256 GB,AMD X870E,TRUE,White,2,5
MSI X870 GAMING PLUS WIFI,$205.99 ,MSI,AM5,DDR5,4,ATX,256 GB,AMD X870,TRUE,Black / White,4,4
Gigabyte B650 EAGLE,$211.80 ,Gigabyte,AM5,DDR5,4,ATX,192 GB,AMD B650,FALSE,Black / Gray,4,3
ASRock X870E Taichi,$329.99 ,ASRock,AM5,DDR5,4,EATX,256 GB,AMD X870E,TRUE,Black,6,5
Asus ROG CROSSHAIR X870E HERO BTF,$737.99 ,Asus,AM5,DDR5,4,ATX,256 GB,AMD X870E,TRUE,Black,4,5
ASRock B550M-HDV,$69.98 ,ASRock,AM4,DDR4,2,Micro ATX,64 GB,AMD B550,FALSE,Black,4,1
Asus ROG STRIX B860-I GAMING WIFI,$199.99 ,Asus,LGA1851,DDR5,2,Mini ITX,128 GB,Intel B860,TRUE,Black / Silver,4,2
Gigabyte B650E AORUS ELITE X AX ICE,$189.99 ,Gigabyte,AM5,DDR5,4,ATX,192 GB,AMD B650E,TRUE,Silver / White,4,3
Gigabyte X870E AORUS MASTER,$379.99 ,Gigabyte,AM5,DDR5,4,ATX,256 GB,AMD X870E,TRUE,Black,4,4
Asus ROG STRIX B850-G GAMING WIFI,$229.99 ,Asus,AM5,DDR5,4,Micro ATX,256 GB,AMD B850,TRUE,White,2,4
Asus PRIME B550-PLUS AC-HES,$89.99 ,Asus,AM4,DDR4,4,ATX,128 GB,AMD B550,TRUE,Silver / Black,6,2
Supermicro MBD-X10DAL-I-O,$725.00+,Supermicro,2 x LGA2011-3,DDR4,8,ATX,512 GB,Intel C612,FALSE,Black / Green,10,0
MSI X870E GAMING PLUS WIFI,$239.99 ,MSI,AM5,DDR5,4,ATX,256 GB,AMD X870E,TRUE,Black,4,4
Asus ROG CROSSHAIR X670E HERO,$995.00+,Asus,AM5,DDR5,4,ATX,192 GB,AMD X670E,TRUE,Black / Silver,6,4
Gigabyte Z790 AORUS ELITE X WIFI7,$239.99 ,Gigabyte,LGA1700,DDR5,4,ATX,256 GB,Intel Z790,TRUE,Black,6,4
MSI PRO Z790-P WIFI,$199.99 ,MSI,LGA1700,DDR5,4,ATX,256 GB,Intel Z790,TRUE,Black / Silver,6,5
Asus ROG STRIX B550-A GAMING,$234.35 ,Asus,AM4,DDR4,4,ATX,128 GB,AMD B550,FALSE,Black / White,6,2
ASRock B450M PRO4 R2.0,$79.98 ,ASRock,AM4,DDR4,4,Micro ATX,128 GB,AMD B450,FALSE,Gray / Black,4,2
MSI PRO A620M-B,$453.38 ,MSI,AM5,DDR5,2,Micro ATX,128 GB,AMD A620,FALSE,Black,4,1
MSI MAG X670E TOMAHAWK WIFI,$234.99 ,MSI,AM5,DDR5,4,ATX,192 GB,AMD X670E,TRUE,Black,4,4
MSI MPG B850 EDGE TI WIFI,$229.99 ,MSI,AM5,DDR5,4,ATX,256 GB,AMD B850,TRUE,Silver / White,4,4
Gigabyte B550 AORUS ELITE AX V2,$139.99 ,Gigabyte,AM4,DDR4,4,ATX,128 GB,AMD B550,TRUE,Black / Silver,4,2
MSI B760 GAMING PLUS WIFI DDR4,N/A,MSI,LGA1700,DDR4,4,ATX,128 GB,Intel B760,TRUE,Black / Silver,4,2
Asus TUF GAMING B650M-PLUS WIFI,$213.00+,Asus,AM5,DDR5,4,Micro ATX,192 GB,AMD B650,TRUE,Black,4,2
MSI PRO B840-P WIFI,$159.99 ,MSI,AM5,DDR5,4,ATX,256 GB,AMD B840,TRUE,Silver,4,2
Asus TUF GAMING B850M-E WIFI,$169.99 ,Asus,AM5,DDR5,4,Micro ATX,256 GB,AMD B850,TRUE,Black,4,3
Asus ROG STRIX Z890-E GAMING WIFI,$339.99 ,Asus,LGA1851,DDR5,4,ATX,256 GB,Intel Z890,TRUE,Black,4,7
Asus ROG STRIX B850-E GAMING WIFI,$491.95+,Asus,AM5,DDR5,4,ATX,256 GB,AMD B850,TRUE,Black,4,5
Asus ROG STRIX B550-F GAMING,$239.99+,Asus,AM4,DDR4,4,ATX,128 GB,AMD B550,FALSE,Black,6,2
Asus B850 MAX GAMING WIFI W,$159.99 ,Asus,AM5,DDR5,4,ATX,256 GB,AMD B850,TRUE,White,4,3
ASRock B650M-H/M.2+,$99.99 ,ASRock,AM5,DDR5,2,Micro ATX,96 GB,AMD B650,FALSE,Silver / Black,4,3
MSI B850M GAMING PLUS WIFI6E,$242.74 ,MSI,AM5,DDR5,4,Micro ATX,256 GB,AMD B850,TRUE,Silver / White,4,2
ASRock B850M Riptide WiFi,$149.99 ,ASRock,AM5,DDR5,4,Micro ATX,256 GB,AMD B850,TRUE,Black,4,4
ASRock B650M PG Lightning Wifi,$129.99 ,ASRock,AM5,DDR5,4,Micro ATX,256 GB,AMD B650,TRUE,Silver / Black,4,4
MSI MAG Z890 TOMAHAWK WIFI,$229.99 ,MSI,LGA1851,DDR5,4,ATX,256 GB,Intel Z890,TRUE,Black / Yellow,4,4
Asus TUF GAMING B650-E WIFI,$199.99 ,Asus,AM5,DDR5,4,ATX,192 GB,AMD B650,TRUE,Black / Orange,4,3
ASRock B760M PG Lightning Wifi,$99.99 ,ASRock,LGA1700,DDR5,4,Micro ATX,192 GB,Intel B760,TRUE,Black,4,4
MSI B550 GAMING GEN3,$175.99 ,MSI,AM4,DDR4,4,ATX,128 GB,AMD B550,FALSE,Black,6,1
Asus PRIME B760M-A AX,$134.99 ,Asus,LGA1700,DDR5,4,Micro ATX,128 GB,Intel B760,TRUE,Silver / Black,6,2
ASRock H370M-HDV,$71.00 ,ASRock,LGA1151,DDR4,2,Micro ATX,64 GB,Intel H370,FALSE,Black / Silver,4,0
Asus ROG STRIX Z790-A GAMING WIFI II,$579.99+,Asus,LGA1700,DDR5,4,ATX,192 GB,Intel Z790,TRUE,Black / Silver,4,5
Asus X870 MAX GAMING WIFI7,$242.29 ,Asus,AM5,DDR5,4,ATX,256 GB,AMD X870,TRUE,Black,4,3
MSI PRO B860M-A WIFI,$149.99 ,MSI,LGA1851,DDR5,4,Micro ATX,256 GB,Intel B860,TRUE,Silver / Black,4,3
Asus TUF GAMING B550M-PLUS WIFI II,$195.00 ,Asus,AM4,DDR4,4,Micro ATX,128 GB,AMD B550,TRUE,Black / Gray,4,2
Gigabyte A520M DS3H V2,N/A,Gigabyte,AM4,DDR4,4,Micro ATX,128 GB,AMD A520,FALSE,Gray / Brown,4,1
Gigabyte B550M DS3H AC R2,$94.99 ,Gigabyte,AM4,DDR4,4,Micro ATX,128 GB,AMD B550,TRUE,Black,4,2
Asus Prime B450M-A II,$205.00+,Asus,AM4,DDR4,4,Micro ATX,128 GB,AMD B450,FALSE,N/A,6,1
Asus ROG CROSSHAIR X870E APEX,$679.99+,Asus,AM5,DDR5,2,ATX,128 GB,AMD X870E,TRUE,Black,4,5
Asus TUF GAMING A520M-PLUS WIFI,$116.68 ,Asus,AM4,DDR4,4,Micro ATX,128 GB,AMD A520,TRUE,Black / Orange,4,1
MSI MAG Z790 TOMAHAWK WIFI,$209.99 ,MSI,LGA1700,DDR5,4,ATX,256 GB,Intel Z790,TRUE,Black,7,5
MSI PRO B840M-B,$124.98 ,MSI,AM5,DDR5,2,Micro ATX,128 GB,AMD B840,FALSE,Black,4,2
Gigabyte X870E AORUS PRO,$289.99 ,Gigabyte,AM5,DDR5,4,ATX,256 GB,AMD X870E,TRUE,Black,4,4
Asus ROG STRIX B450-F GAMING,$129.99 ,Asus,AM4,DDR4,4,ATX,128 GB,AMD B450,FALSE,Black,6,2
MSI X670E GAMING PLUS WIFI,$210.28+,MSI,AM5,DDR5,4,ATX,192 GB,AMD X670E,TRUE,Silver / Black,4,5
Asus PRIME H610I-PLUS D4-CSM,$112.99 ,Asus,LGA1700,DDR4,2,Mini ITX,64 GB,Intel H610,FALSE,Silver / Black,4,2
Gigabyte B850I AORUS PRO,$259.99 ,Gigabyte,AM5,DDR5,2,Mini ITX,128 GB,AMD B850,TRUE,N/A,2,2
ASRock B850M Pro RS WiFi White,$129.99 ,ASRock,AM5,DDR5,4,Micro ATX,256 GB,AMD B850,TRUE,White,4,4
Asus TUF GAMING B650M-E WIFI,N/A,Asus,AM5,DDR5,4,Micro ATX,192 GB,AMD B650,TRUE,Black,4,2
Gigabyte B650M AORUS ELITE AX,$169.99 ,Gigabyte,AM5,DDR5,4,Micro ATX,192 GB,AMD B650,TRUE,Black,4,2
ASRock G41M-GS,$63.21 ,ASRock,LGA775,DDR2,2,Micro ATX,8 GB,Intel G41,FALSE,Blue / White,0,0
Gigabyte X870 AORUS STEALTH ICE,$305.99 ,Gigabyte,AM5,DDR5,4,ATX,256 GB,AMD X870,TRUE,White,2,4
Gigabyte Z890 AORUS ELITE WIFI7,$239.99 ,Gigabyte,LGA1851,DDR5,4,ATX,256 GB,Intel Z890,TRUE,Black,4,4
Gigabyte X870 GAMING WIFI6,$179.00+,Gigabyte,AM5,DDR5,4,ATX,256 GB,AMD X870,TRUE,Black / Gray,4,3
ASRock B650 Pro RS WiFi,$129.99 ,ASRock,AM5,DDR5,4,ATX,256 GB,AMD B650,TRUE,Silver / Black,4,3
ASRock A520M-ITX/ac,$99.99 ,ASRock,AM4,DDR4,2,Mini ITX,64 GB,AMD A520,TRUE,Black / Silver,4,2
ASRock B850 Pro RS,$139.99 ,ASRock,AM5,DDR5,4,ATX,256 GB,AMD B850,FALSE,Silver / Black,4,5
Asus Z790-AYW WIFI W II,$159.99 ,Asus,LGA1700,DDR5,4,ATX,192 GB,Intel Z790,TRUE,White,4,3
ASRock B850 Steel Legend WiFi,$169.99 ,ASRock,AM5,DDR5,4,ATX,256 GB,AMD B850,TRUE,White / Black,4,5
Gigabyte B650M D3HP AX,$139.99 ,Gigabyte,AM5,DDR5,4,Micro ATX,192 GB,AMD B650,TRUE,Black / Gray,4,2
Gigabyte B450M DS3H,N/A,Gigabyte,AM4,DDR4,4,Micro ATX,128 GB,AMD B450,FALSE,Black / Silver,4,1
MSI PRO X870-P WIFI,$199.99 ,MSI,AM5,DDR5,4,ATX,256 GB,AMD X870,TRUE,Black / Silver,4,3
Gigabyte B650I AX,$218.93 ,Gigabyte,AM5,DDR5,2,Mini ITX,96 GB,AMD B650,TRUE,Black,2,1
Asus ROG STRIX X870-F GAMING WIFI,$329.99 ,Asus,AM5,DDR5,4,ATX,192 GB,AMD X870,TRUE,Black,2,4
ASRock A620M-HDV/M.2,$109.99+,ASRock,AM5,DDR5,2,Micro ATX,96 GB,AMD A620,FALSE,Gray / Black,2,3
Asus ROG STRIX B760-I GAMING WIFI,$281.25+,Asus,LGA1700,DDR5,2,Mini ITX,96 GB,Intel B760,TRUE,Black,4,2
Asus PRIME B650M-A WIFI II,$474.39 ,Asus,AM5,DDR5,4,Micro ATX,192 GB,AMD B650,TRUE,Black / Silver,4,2
Asus TUF GAMING Z890-PLUS WIFI,$259.99 ,Asus,LGA1851,DDR5,4,ATX,256 GB,Intel Z890,TRUE,Black,4,4
ASRock X870 Pro RS,$169.99 ,ASRock,AM5,DDR5,4,ATX,256 GB,AMD X870,FALSE,White,4,4
Gigabyte Z790 AORUS PRO X WIFI7,$269.99 ,Gigabyte,LGA1700,DDR5,4,ATX,256 GB,Intel Z790,TRUE,Black,4,5
Gigabyte X870 GAMING X WIFI7,$219.99 ,Gigabyte,AM5,DDR5,4,ATX,256 GB,AMD X870,TRUE,Black,4,3
MSI B650M PROJECT ZERO,$179.99 ,MSI,AM5,DDR5,4,Micro ATX,256 GB,AMD B650,TRUE,Silver / Black,4,3
ASRock H470M-HVS,N/A,ASRock,LGA1200,DDR4,2,Micro ATX,64 GB,Intel H470,FALSE,Black / Silver,4,0
Asus ROG STRIX B450-F GAMING II,N/A,Asus,AM4,DDR4,4,ATX,128 GB,AMD B450,FALSE,Black,6,2
Asus ROG STRIX X870E-H GAMING WIFI7 HATSUNE MIKU EDITION,$575.99 ,Asus,AM5,DDR5,4,ATX,256 GB,AMD X870E,TRUE,Black / Blue,4,4
Asus TUF GAMING B760M-PLUS WIFI II,$238.54 ,Asus,LGA1700,DDR5,4,Micro ATX,192 GB,Intel B760,TRUE,Black / Orange,4,3
MSI Z390-A PRO,$280.00+,MSI,LGA1151,DDR4,4,ATX,128 GB,Intel Z390,FALSE,Brown / Black,6,2
Gigabyte B650I AORUS ULTRA,$218.95 ,Gigabyte,AM5,DDR5,2,Mini ITX,96 GB,AMD B650,TRUE,Black / Silver,4,4
MSI PRO B650-P WIFI,$159.99 ,MSI,AM5,DDR5,4,ATX,192 GB,AMD B650,TRUE,Black,6,2
Asus PRIME B850-PLUS WIFI,$159.99 ,Asus,AM5,DDR5,4,ATX,256 GB,AMD B850,TRUE,Black / Silver,4,3
MSI PRO B850M-A WIFI,$168.99 ,MSI,AM5,DDR5,4,Micro ATX,128 GB,AMD B850,TRUE,Black / Silver,4,2
Asus PRIME B650M-A AX II,$169.99 ,Asus,AM5,DDR5,4,Micro ATX,192 GB,AMD B650,TRUE,Black / Silver,8,2
MSI MAG X870E TOMAHAWK MAX WIFI PZ,$319.99 ,MSI,AM5,DDR5,4,ATX,256 GB,AMD X870E,TRUE,White / Gray,4,4
ASRock Z790 PRO RS WIFI,$152.99 ,ASRock,LGA1700,DDR5,4,ATX,256 GB,Intel Z790,TRUE,Silver / Black,8,5
Asus Z890 AYW GAMING WIFI W,$195.00+,Asus,LGA1851,DDR5,4,ATX,256 GB,Intel Z890,TRUE,White,4,4
Asus ROG MAXIMUS Z890 HERO,$399.99 ,Asus,LGA1851,DDR5,4,ATX,256 GB,Intel Z890,TRUE,Black,4,6
Asus PRIME X870-P WIFI,$209.99 ,Asus,AM5,DDR5,4,ATX,192 GB,AMD X870,TRUE,Black / Silver,2,4
Gigabyte X870E AORUS ELITE X3D,$379.99 ,Gigabyte,AM5,DDR5,4,ATX,256 GB,AMD X870E,TRUE,Black,4,4
MSI B850 GAMING PRO WIFI6E,$189.99 ,MSI,AM5,DDR5,4,ATX,256 GB,AMD B850,TRUE,Black / Silver,4,2
ASRock Phantom Gaming X870 Riptide WiFi,$179.99 ,ASRock,AM5,DDR5,4,ATX,256 GB,AMD X870,TRUE,Black / Purple,4,4
Gigabyte B850 AORUS STEALTH ICE,$264.99 ,Gigabyte,AM5,DDR5,4,ATX,256 GB,AMD B850,TRUE,White,2,4
Gigabyte B550M DS3H,$229.55+,Gigabyte,AM4,DDR4,4,Micro ATX,128 GB,AMD B550,FALSE,Black / Gold,4,2
MSI B550M PRO-VDH,$182.76 ,MSI,AM4,DDR4,4,Micro ATX,128 GB,AMD B550,FALSE,Black,4,2
Gigabyte B760I AORUS PRO,$199.99 ,Gigabyte,LGA1700,DDR5,2,Mini ITX,96 GB,Intel B760,TRUE,Silver / Black,2,2
Asus TUF GAMING B650-PLUS,$189.99 ,Asus,AM5,DDR5,4,ATX,128 GB,AMD B650,FALSE,Black / Orange,4,3
ASRock B860M-X WiFi,$129.99 ,ASRock,LGA1851,DDR5,2,Micro ATX,128 GB,Intel B860,TRUE,Silver / Black,4,3
ASRock B550M Phantom Gaming 4,$74.98 ,ASRock,AM4,DDR4,4,Micro ATX,128 GB,AMD B550,FALSE,Black,4,2
Gigabyte TRX40 AORUS XTREME,$849.99+,Gigabyte,sTRX4,DDR4,8,XL ATX,256 GB,AMD TRX40,TRUE,Black / Silver,10,4
MSI PRO A620M-E,$89.99 ,MSI,AM5,DDR5,2,Micro ATX,96 GB,AMD A620,FALSE,Black,4,1
ASRock X870 Pro-A WiFi,$169.99 ,ASRock,AM5,DDR5,4,ATX,256 GB,AMD X870,TRUE,Black,4,3
Gigabyte B650M AORUS ELITE AX ICE,$179.99 ,Gigabyte,AM5,DDR5,4,Micro ATX,192 GB,AMD B650,TRUE,Silver,4,2
Gigabyte X870E AORUS PRO X3D ICE,$389.99 ,Gigabyte,AM5,DDR5,4,ATX,256 GB,AMD X870E,TRUE,White,4,4
Gigabyte A520M S2H,$79.98 ,Gigabyte,AM4,DDR4,2,Micro ATX,64 GB,AMD A520,FALSE,Black,4,1
Gigabyte H610M H V3 DDR4,$123.03 ,Gigabyte,LGA1700,DDR4,2,Micro ATX,64 GB,Intel H610,FALSE,Black / Silver,4,1
Asus PRIME A520M-K,$127.52+,Asus,AM4,DDR4,2,Micro ATX,64 GB,AMD A520,FALSE,Black / Silver,4,1
Gigabyte B550M DS3H R2,N/A,Gigabyte,AM4,DDR4,4,Micro ATX,128 GB,AMD B550,FALSE,Black,4,2
ASRock B250M-HDV,N/A,ASRock,LGA1151,DDR4,2,Micro ATX,32 GB,Intel B250,FALSE,Black / White,6,1
ASRock B650M PG RIPTIDE WIFI,$129.99 ,ASRock,AM5,DDR5,4,Micro ATX,256 GB,AMD B650,TRUE,Black,4,3
ASRock B850 LiveMixer WiFi,$189.99 ,ASRock,AM5,DDR5,4,ATX,256 GB,AMD B850,TRUE,Silver / Black,2,4
ASRock B850 Pro RS WiFi,$149.99 ,ASRock,AM5,DDR5,4,ATX,256 GB,AMD B850,TRUE,Silver / Black,4,5
ASRock B450M Steel Legend,$92.29 ,ASRock,AM4,DDR4,4,Micro ATX,128 GB,AMD B450,FALSE,Black / White,4,2
Supermicro MBD-X10DAX,N/A,Supermicro,2 x LGA2011-3,DDR4,16,EATX,2048 GB,Intel C612,FALSE,Green / Black,10,0
Asus ROG STRIX B650E-E GAMING WIFI,N/A,Asus,AM5,DDR5,4,ATX,192 GB,AMD B650E,TRUE,Black,4,4
MSI B840 GAMING PLUS WIFI,$154.99 ,MSI,AM5,DDR5,4,ATX,256 GB,AMD B840,TRUE,Silver / Black,4,2
Asus TUF GAMING X670E-PLUS WIFI,$209.99 ,Asus,AM5,DDR5,4,ATX,192 GB,AMD X670E,TRUE,Black / Orange,4,4
MSI PRO B760M-A WIFI DDR4,$204.99 ,MSI,LGA1700,DDR4,4,Micro ATX,128 GB,Intel B760,TRUE,Black,4,2
Gigabyte B650M S2H,$145.27+,Gigabyte,AM5,DDR5,2,Micro ATX,96 GB,AMD B650,FALSE,Black / Gray,4,1
ASRock H510M-HDV/M.2 SE,$69.98 ,ASRock,LGA1200,DDR4,2,Micro ATX,64 GB,Intel H470,FALSE,Black / Silver,4,1
Asus PRIME B550-PLUS,$165.37 ,Asus,AM4,DDR4,4,ATX,128 GB,AMD B550,FALSE,Black / White,6,2
Gigabyte B860 DS3H WIFI6E,$159.98 ,Gigabyte,LGA1851,DDR5,4,ATX,256 GB,Intel B860,TRUE,Silver / Black,4,2
Asus PRIME Z390-A,$340.00+,Asus,LGA1151,DDR4,4,ATX,128 GB,Intel Z390,FALSE,Silver / Black,6,2
ASRock X870E Taichi Lite,$299.99 ,ASRock,AM5,DDR5,4,EATX,256 GB,AMD X870E,TRUE,Black / Silver,6,5
Asus TUF GAMING B850-BTF WIFI W,$270.99 ,Asus,AM5,DDR5,4,ATX,256 GB,AMD B850,TRUE,White / Silver,4,3
Gigabyte X870E AORUS ELITE WIFI7 ICE,$342.99 ,Gigabyte,AM5,DDR5,4,ATX,256 GB,AMD X870E,TRUE,White,4,4
Gigabyte B550M AORUS ELITE,$144.68 ,Gigabyte,AM4,DDR4,4,Micro ATX,128 GB,AMD B550,FALSE,Black / Orange,4,2
